How to recognize a dystopia	TED	10EN11				
What Are the Universal Human Rights	TED	10EN11				
How to recognize a dystopia	TED	10EN11				
Make Your Writing Suspenseful	TED	10EN18				
Make Your Writing Suspenseful	TED	10EN18				
What Happens in a Heart Attack?	TED	10H05				
What Is Invisible	TED	10S01				
What Is Epigenetics	TED	10S04				
What Happens During A Stroke	TED	10S05				
The Science Of Smog	TED	10S06				
Perpetual Motion Machines	TED	10S07				
Einstein General Relativity	TED	10S12				
How Many Universes Are There	TED	10S12				
Where Is Evidence of Aliens	TED	10S12				
How Small Are We	TED	10S12				
Where Does Gold Come From	TED	10S14				
Is DNA the Future of Data Storage	TED	10S04				
What Causes Kidney Stones	TED	10S05				
What Happens During A Stroke	TED	10S05				
Your Muscular System	TED	10S05				
Your Muscular System	TED	10S05				
What does the liver do	TED	10S05				
What Causes Kidney Stones	TED	10S05				
What makes a poem a poem	TED	11EN03				
Overview of China 1949 to 2008	TED	11EN04				
Qin Dynasty History Video	TED	11EN04				
Where do superstitions come from?	TED	11EN08				
Where do superstitions come from?	TED	11EN18				
How high can you count on your fingers	TED	1M06				
Is DNA the Future of Data Storage	TED	1S04				
Read A Thermometer	TED	3M01				
Rainy Day	TED	3S03				
How high can you count on your fingers	TED	4M04				
History of Numerical Systems	TED	4M04				
Where Do Math Symbols Come From	TED	4M05				
Where Do Math Symbols Come From	TED	4M05				
Read Bar Graphs	TED	4M14				
Order Of Operations	TED	5M04				
Orangutans Are Smart	TED	5S04				
How Plants Defend Themselves	TED	5S04				
How Plants Defend Themselves	TED	5S04				
How Plants Defend Themselves	TED	5S04				
Lives Of Baby Fish	TED	5S05				
How to master your smell sense	TED	6H01				
Learn From Ancient Skeletons	TED	6H01				
Learn From Ancient Skeletons	TED	6H01				
How to master your smell sense	TED	6H01				
How Does Your Immune System Work	TED	6H04				
The Immune System Explained	TED	6H04				
Quadrilateral Overview	TED	6M05				
How To Spot A Misleading Graph	TED	6M20				
How To Spot A Misleading Graph	TED	6M20				
Can Plants Talk	TED	6S04.04				
How Does Big Ben Keep Time	TED	6S02				
What Is A Smartphone Made Of	TED	6S02.02				
Bioluminescence	TED	6S03				
How do animals experience pain	TED	6S03				
Why Do Whales Sing	TED	6S03				
Why are sharks so awesome	TED	6S03				
Why the Insect Brain is Incredible	TED	6S03				
Win Lottery & Become Happy?	TED	6S03				
Why are sharks so awesome	TED	6S03				
Nurdles Domination Quest	TED	6S04				
A Guide To The Energy Of The Earth	TED	6S07				
Why Is Glass Transparent	TED	6S07.03				
How Do Fish Make Electricity	TED	6S08.02				
How Do Fish Make Electricity	TED	6S08.02				
Why Do Whales Sing	TED	6S03				
How do animals experience pain	TED	6S03				
How do glasses help us see	TED	6S07.03				
English Has How Many Verb Tenses	TED	7EN01				
English Has How Many Verb Tenses	TED	7EN01				
Why Do We Hiccup	TED	7H01				
Oxygen's Journey In Your body	TED	7H01				
If You Did Not Drink Water	TED	7H01				
The food you eat affects your gut	TED	7H01				
Surprising Cause Of Ulcers	TED	7H01, 6H04				
How do drugs affect the brain?	TED	7H02				
What causes addiction?	TED	7H02				
How Food Affects Your Brain	TED	7H03				
Should We Eat Bugs	TED	7H03				
Why Get A Flu Shot Every Year	TED	7H04				
The History of Surfing	TED	7H07				
The History of Surfing	TED	7H07				
Why are sloths so slow	TED	7S03				
Why are sloths so slow	TED	7S03				
Renewables Power The World	TED	7S07				
How Does Fracking Work	TED	7S07				
How Do Solar Panels Work?	TED	7S07				
How Does Fracking Work	TED	7S07				
Send A Spacecraft To Psyche	TED	7S11				
Renewables Power The World	TED	7S07				
What If The World Went Vegetarian	TED	8EN16				
What If The World Went Vegetarian	TED	8EN16				
Why Make Irrational Decisions	TED	8H01				
Practice Effectively for Anything	TED	8H01				
What does the liver do	TED	8H01				
Body With Mind	TED	8H01				
Why do we itch	TED	8H01				
Body With Mind	TED	8H01				
How Does Your Immune System Work	TED	8H01				
The Immune System Explained	TED	8H01				
How do your hormones work?	TED	8H01, 9S05				
How Great Leaders Inspire	TED	8H02				
How To Be A Global Citizen	TED	8H02				
What is bipolar disorder	TED	8H02				
What is depression?	TED	8H02				
How Food Affects Your Brain	TED	8H03				
The food you eat affects your gut	TED	8H03				
What Is Aphasia	TED	8H04				
How does asthma work	TED	8H04				
What Happens in a Heart Attack?	TED	8H04				
Why Is It So Hard To Cure Cancer	TED	8H04				
Why Get A Flu Shot Every Year	TED	8H04				
How does asthma work	TED	8H04				
Why Is It So Hard To Cure Cancer	TED	8H04				
Who Is At Risk For Colon Cancer	TED	8H04				
The most common STI in the world	TED	8H04				
How Contra ceptives Work	TED	8H05				
What is bipolar disorder	TED	8H02				
A History Of Banned Numbers	TED	8M03				
A History Of Banned Numbers	TED	8M03				
Why do we itch	TED	8S01				
Quadrocopter And Ball	TED	8S02				
How A Transistor Works	TED	8S02				
How A Transistor Works	TED	8S02				
Membranes Are Complicated	TED	8S03				
Oxygen's Journey In Your body	TED	8S03				
The Frog Barfs Up Its Babies	TED	8S05				
The Frog Barfs Up Its Babies	TED	8S05				
How An Igloo Keeps You Warm	TED	8S07				
Membranes Are Complicated	TED	8S07				
How An Igloo Keeps You Warm	TED	8S07				
Other Life In The Universe	TED	8S11				
What Are Gravitational Waves	TED	8S11				
The First Asteroid Discovered	TED	8S11				
The First Asteroid Discovered	TED	8S11				
What Are Gravitational Waves	TED	8S11				
Find The Next Number	TED	9M08				
Find The Next Number	TED	9M08				
Prove The Pythagorean Theorum	TED	9M20				
Prove The Pythagorean Theorum	TED	9M20				
Wacky History Of Cell Theory	TED	9S02				
Our Story In 1 Minute	TED	9S04				
Our Story In 2 Minutes	TED	9S04				
Civilization Across The Galaxy	TED	9S04				
Jellyfish Predate Dinosaurs	TED	9S04				
How Did Teeth Evolve	TED	9S04				
Dinosaurs of the Sahara	TED	9S04				
How Did Teeth Evolve	TED	9S04				
Dinosaurs of the Sahara	TED	9S04				
Our Bodies After We Die	TED	9S05				
Why Do Our Bodies Age	TED	9S05				
How does body know the time?	TED	9S05				
Left Versus Right Brain Myth	TED	9S05				
What Are Mini Brains	TED	9S05				
Left Versus Right Brain Myth	TED	9S05				
How does body know the time?	TED	9S05				
Will The Ocean Run Out Of Fish	TED	9S06				
What Is A Vector	TED	9S07				
How does work…work?	TED	9S08				
Challenges of Nuclear Power	TED	9S09				
Perpetual Motion Machines	TED	9S09				
A Guide To The Energy Of The Earth	TED	9S09				
How do glasses help us see	TED	9S10				
Why Is Glass Transparent	TED	9S10				
Reflections On Life	TED	9S12				
Our Story In 1 Minute	TED	9S12				
Could We Create Dark Matter	TED	9S12				
The Universe In A Grain Of Dust	TED	9S12				
The Universe In A Grain Of Dust	TED	9S12				
How Small Is An Atom?	TED	9S14				
What is entropy	TED	9S14				
What is entropy	TED	9S14				
Nothing Sticks To Teflon	TED	9S15				
Nothing Sticks To Teflon	TED	9S15				
What Could GMO Do?	TED	9S19				
Challenges of Nuclear Power	TED	9S09				